{
  "method": "POST",
  "url": "http://localhost:3000/api/users?sort=asc",
  "server": "localhost:3000",
  "path": "/api/users",
  "clientIp": "192.168.1.100",
  "latency": 120,
  "request": {
    "payload": "{\"name\":\"Marco Polo\",\"email\":\"marco@polo-ventures.com\"}",
    "headers": {
      "Content-Type": "application/json",
      "Host": "localhost:3000"
    },
    "queryParams": {
      "sort": "asc"
    },
    "timestamp": "2025-02-14T15:00:00.000Z"
  },
  "response": {
    "payload": "{\"success\":true,\"id\":123}",
    "headers": {
      "Content-Type": "application/json"
    },
    "statusCode": 200,
    "statusMessage": "OK",
    "timestamp": "2025-02-14T15:00:00.120Z"
  }
}
